paper_mechanism,source_location,phase5_map,claim_status
open-flux polar cap nearly disappears,Abstract + Results,projection-collapse warning: apparent open region vanishes as topology recloses,strong analogue
dual-lobe reconnection consumes and recloses open lobe field lines,"Abstract, Results, Summary",closure operator / L-boundary recustody before projection,strong analogue
HCA poleward edges merge in both hemispheres,"Results, Figure 2",two-sided boundary edges converge under retained topology change,strong analogue
CDPS formed by captured magnetosheath plasma at dawn/dusk flanks,"Results, Figure 3/4","boundary-incidence material carrier, not just scalar flux",strong analogue
KHI at CDPS edges generates arcs/fine structures,Results + Summary,edge instability as native boundary-coupling generator,candidate mechanism
field-aligned mapping from magnetosphere to ionosphere,Figure 4 caption,projection map from retained 3D topology to visible readout,strong analogue
calabash-shaped shortened magnetotail,Abstract + Results + Summary,global carrier shape changes after closure/reconnection,strong analogue
simulation/observation consistency with THEMIS but no tail satellite,Results + Figure S4,"partial validation, missing direct retained-state probe",limit preserved
